title,localisation,desc,link,date,entreprise,note
Data Analyst  H/F,Lyon,"A propos de BedrockBedrock est leader européen dans la conception et le développement de plateformes de streaming pour les grands groupes de médias. Fondée par M6 et RTL Group / Bertelsmann, la société compte aujourd’hui plus de 200 collaborateurs répartis entre les sites de Paris et de Lyon, et près de 30 millions d’utilisateurs en Europe. Dans le cadre d’une forte croissance de ses investissements technologiques, Bedrock vise un doublement de ses effectifs d’ici 3 ans.Si vous êtes passionné(e)s par l’univers des technologies et des médias, et que vous aspirez à développer les applications de streaming vidéo de demain, rejoignez-nous !Missions principalesAu sein du pôle Data, nous recherchons des Data Analyst pour intégrer une équipe en forte croissance composée de Lead Data, Machine Learning Engineer, Data Scientists. Votre rôle consiste à faire parler la donnée et faciliter la prise de décision :Extraire et traduire des données brutes en données actionnables en établissant les définitions et les « data models » permettant leur utilisation à des fins de mesure de la performance business et opérationnelAnalyser et modéliser nos larges quantités de données afin d’améliorer l’expérience de nos utilisateursDévelopper et maintenir la documentation techniqueCommuniquer et évangéliser les utilisateurs de la dataIdentifier des nouvelles sources de données pertinentesAssurer une veille sur la qualité des donnéesQualificationsDiplômé(e) d’un Master en Statistiques ou Mathématiques appliquées, Économétrie ou Data Science, vous disposez d’au moins 2 ans d’expérience sur un poste similaire.Vous avez une excellente maîtrise des bases de données SQL et des compétences avancées en statistiques /informatique. Vous faites preuve d’une grande curiosité, d’excellentes capacités d’analyse et de synthèse ainsi qu’une forte appétence pour la résolution de problème.Vous disposez de réelles aptitudes avec la manipulation de données chiffrées , en organisation ainsi qu'un fort esprit d'initiativeVous aimez faire du storytelling en utilisant la data visualisationVous avez un bon niveau d'anglais oral et écrit.Tech@BedrockBack-end : PHP, Symfony,...Front-end : JS, React, Vue, Node,...DevOps : AWS, Kubernetes, Terraform,...Data : Python, Scala,...Mobile : Swift, Java,...Life@BedrockIntégrer une société tech en forte croissance avec plus de 10 ans d’expériences et s’appuyer sur de solides actionnaires dans le monde des médias,Passion, curiosité et esprit d’équipe dans un environnement “challenging” et unique,Développement des compétences et large place au “knowledge sharing” : conférences, meetups, talks, veille, R&D,...Plus de 200 collaborateurs à la Technique et au Produit. Des équipes agiles (maximum 8 personnes) et une proximité avec le management.Niveau hiérarchiqueConfirméType d’emploiTemps pleinFonctionTechnologies de l’informationSecteursTechnologies et services de l’informationDivertissementsMédias en ligne",https://fr.linkedin.com/jobs/view/data-analyst-h-f-at-bedrock-1821622835?refId=ca677af0-294d-4686-8077-21288fd737d0&position=19&pageNum=3&trk=public_jobs_job-result-card_result-card_full-click,2020-05-04,Bedrock,NA
Data Scientist for commodity Market Analyst,Courbevoie,"Who we are:ENGIE is a global energy company, a leading provider of electricity, natural gas, and energy services. With 153,090 employees in more than 70 countries worldwide, ENGIE achieved revenue of €66.6 billion in 2016. ENGIE is committed to being a leader in the energy transition.We are looking for talented and motivated people to create the future of energy. Join a rewarding and flexible work environment that encourages innovation and creativity, and help us meet the energy challenges of today and tomorrow.Global Energy Management (GEM) is one of ENGIE’s Business Units. We deliver services in supply and logistics management, asset management, risk management, market access management, while contributing to the market understanding, design and efficiency and developing market solutions to accelerate the energy transition.GEM manages one of the largest and most diversified energy portfolios in Europe, including electricity, natural gas, bulk commodities and environmental products.With 5 trading platforms and activities in more than 50 countries, GEM has an extended geographical coverage in Europe, Asia-Pacific and in the US. It employs 1,300 people around the world.Organization:The data scientist will be part of an extended team of market analysts and meteorologists who sit on the trading floor.We offerIntellectually challenging jobIntegration within a larger team of experienced market analystsAutonomy and possibility to take responsibilitiesPossibility to grow, learn and develop, including some attendance to conferenceContext:Targeting superior energy market knowledge, we build independent analyses and provide positions to give to GEM & Engie a competitive advantageDeveloping consistent market views (gas, power, oil, bulk, carbon, meteo) to explain market moves and forecast future evolutionDelivering ad-hoc fundamental, statistical and technical analysesPro-actively seeking innovative solutions to improve sales, traders and business developers performance as well as to support senior managers in their decision making processProviding market analysis reports and services to a defined set of internal and external clients.Providing strategic insights on new businesses linked to energy transitionRepresenting GEM in external forum or conferences in relation with energy market knowledgeRole:The Data Scientist will coordinate developments of the team on innovative methods to analyze commodity markets. He/She will focus on fostering machine learning, automated analysis on gas & power market fundamentals (supply/ demand forecast). He/She will support the traders and GEM front entities and develop directional market views.Main Activities:His/Her activities will cover the following:Develop and maintain machine learning models to forecast supply & demand components of gas & power marketsDevelop and maintain models to forecast market prices in collaboration with market analystsCoach team members in the domain of data science and machine learningContribute to projects with traders and portfolio managersContribute to data collection, cleaning and analysisFollow academic developments in the domain of machine learning applied to commodity markets and meteoPromote team spirit and collaboration.Work location:Courbevoie, ENGIE T1Travels:Regular travelsENGIE Global Markets FRJobTrading / Portfolio managementPrimary LocationEurope-France-Île-de-France-CourbevoieOrganizationGlobal Energy ManagementScheduleFull-timeNature of ResponsibilityManager / ExpertJob PostingApr 6, 2020, 12:20:15 PMNiveau hiérarchiquePremier emploiType d’emploiTemps pleinFonctionIngénierieTechnologies de l’informationSecteursPétrole et énergieBanquesServices financiers",https://fr.linkedin.com/jobs/view/data-scientist-for-commodity-market-analyst-at-engie-global-energy-management-solutions-1793235392?refId=ca677af0-294d-4686-8077-21288fd737d0&position=20&pageNum=3&trk=public_jobs_job-result-card_result-card_full-click,2020-05-04,ENGIE Global energy management solutions,NA
Senior Data scientist,Saint-Cloud,"It's fun to work in a company where people truly BELIEVE in what they're doing!We're committed to bringing passion and customer focus to the business.Created in 2000, Kyriba now has more than 770 employees. The Franco-American company has its headquarters in San Diego and R&D is located in Paris. Kyriba also has offices in London, Minsk, Tokyo, Hong Kong, Rio de Janeiro, Singapore, Shanghai and Dubai.Kyriba is the world leader in cash management and payment solutions in the cloud, providing the best technologies for CFOs, treasurers and finance professionals.A complete suite of modules is available: cash management, market operations (debt, investment, interest rate, foreign exchange), international banking communication, payments and supply chain financing (early payment programs). Kyriba has prestigious and demanding customers, including companies such as Blablacar, BBC, Eurostar, Expedia and EA. More than 2,200 companies use Kyriba's features on a daily basis in more than 100 countries.General PurposeAs part of our data-as-a-service vision, Kyriba is investing in AI and ML. We want to automate the manual and time-consuming tasks performed daily by our customers and provide them insights to make better decisions.In a team of about fifteen people, specialized in Business Intelligence and Data, mixing product and technical expertise, you will be involved in the research and development phase on various data science topics under study and to come to Kyriba. You will be the reference for data science in Kyriba.Your Role Respond to use cases submitted by the Product team and the Engineering team.  Proposing research orientations on the different use cases identified across the four main products of Kyriba: Treasury, Payment, Risk management, Supply Chain Finance. The use cases are diversified, such as Fraud detection, cash Forecasting, Predictive maintenance for instance.  Select, implement and improve the models. You will be required to work in pre-sales situations with customers in order to create prototypes to demonstrate the machine learning concepts you master. You will then help the Engineering team to industrialize the prototypes selected by the Product team. Your Profile Master degree in data science. Your academic background has naturally led you to a career oriented towards research and development. Data Science, Machine Learning, Deep Learning, Natural Language Processing fascinate you and you know how to talk about it  A minimum of 5 years of experience in data science, in particular in machine learning. You want to evolve towards management.  You are creative and curious by nature. Large-scale machine learning (Big Data) and the industrialization of machine learning pipelines are subjects that you consider to be of primary importance. You listen to your customers.  Ability to work in an international team. English in both written and spoken form is a daily practice.  The candidate will be asked to document and present the progress of this work to the team but also to a wider audience (popularization skills appreciated).Niveau hiérarchiqueConfirméType d’emploiTemps pleinFonctionAutreSecteursLogiciels informatiquesRecrutement Services financiers",https://fr.linkedin.com/jobs/view/senior-data-scientist-at-kyriba-1796243291?refId=ca677af0-294d-4686-8077-21288fd737d0&position=21&pageNum=3&trk=public_jobs_job-result-card_result-card_full-click,2020-05-04,Kyriba,NA
Data Analyst,Champcueil,"Description De La MissionLeader français de l'expertise automobile, BCA Expertise emploie 1400 collaborateurs dont 600 experts et 400 conseillers clients répartis dans 42 Unités d'Expertise et 16 Centres de Service Client. Sa vocation première est la réalisation d'expertises automobiles sur l'ensemble du territoire français, pour le compte notamment de compagnies d'assurance, de courtiers, de constructeurs et de particuliers.Vous intégrerez la Direction Pilotage et Performance du Siège Social situé à Asnières-sur-Seine, composée de 10 personnes.La DPP joue un rôle clé dans le pilotage stratégique et opérationnel de l'entreprise. En synergie avec les autres directions, elle œuvre afin de mettre en place et réaliser les outils de pilotage et/ou les études qui répondront au mieux aux besoins des clients internes et externes.La mission consiste à réaliser de projets de Business Intelligence répondant aux besoins des opérationnels.Rattaché(e) à la Responsable Pilotage Opérationnel vous prendrez part à :La réalisation d'analyses de data mining répondant à une problématique de l'entreprise, de la direction Pilotage Performance ou de l'un de nos clientsLa création de tableaux de bord et de reporting sur Power BILa spécification des besoins « Data » dans le cadre de l'évolution du système opérationnel et la mise en place d'une plateforme Salesforce (comparaison de données, qualité des données, vérification de la complétude, format des champs…)La réalisation d'extraction de données pour répondre à des demandes utilisateursLa mise en place et le maintien d'aides à l'utilisation des outils BI à la disposition des opérationnelsSelon l'activité de la direction Pilotage et Performance, d'autres missions connexes pourront vous être confiées. ProfilVous êtes titulaire d'un diplôme de niveau Bac +4/5 spécialisé en Analyse Data Mining et/ou Décisionnel. Vous connaissez le système de gestion de base de données (SGBD) et vous avez connaissance du langage SQL.Vous disposez d'une première expérience (Stage, CDD, CDI).Bon relationnel, dynamisme, esprit de synthèse, rigueur, force de proposition, esprit d'équipe, sont des qualités qui vous caractérisent. Vous maîtrisez les outils bureautiques (Excel, Word, Power Point) et saurez vulgariser votre activité auprès d'un public non averti.Alors rejoignez-nous !La maîtrise de l'outil Power BI est nécessaire. Critères candidat Niveau d'études min. requisBac+4 Niveau d'expérience min. requisde 1 à 3 ans Critères libresPoste à pourvoir en CDI.Rémunération entre 40k et 48K selon expérience.BCA Expertise Compte De Nombreux Avantages Mutuelle, fond de garantie, CE, intéressement, RTT et nombreux CP, Package salariale composé d'un fixe et d'un bonus objectif selon profil.Les postes sont à pourvoir au Siège Social qui propose une salle de sport, un parking, des services (Conciergerie et autres) et un Restaurant Inter-Entreprises.Proximité RER C Les Grésillions.Niveau hiérarchiquePremier emploiType d’emploiTemps pleinFonctionTechnologies de l’informationSecteursTechnologies et services de l’informationAssurancesServices financiers",https://fr.linkedin.com/jobs/view/data-analyst-at-bca-expertise-1805496957?refId=ca677af0-294d-4686-8077-21288fd737d0&position=22&pageNum=3&trk=public_jobs_job-result-card_result-card_full-click,2020-05-04,BCA Expertise,NA
Data Scientist (H/F),Paris,"Dans le cadre de son développement, Quantic Dream recherche des collaborateurs talentueux pour rejoindre ses équipes sur ses prochaines ambitieuses productions.Au sein de l'équipe R&D Maya, vous apporterez vos connaissances notamment en Machine Learning et Deep Learning afin de permettre le développement de notre nouvel outils interne propriétaire de reconnaissance faciale à partir d'une vidéo (tracking vidéo).En Étroite Collaboration Avec Le Lead Et Un Développeur Recherche & Développement Outils 3d De L'équipe, Vos Missions Seront Les SuivantesAnalyser et effectuer des recherches en développement dans le cadre du développement d'un nouveau solver facial in-house à base de tracking vidéo ;Effectuer des recherches/veille technologique afin de prototyper et d'adapter notre stratégie en conséquence dans la perspective d'implémenter ce nouvel outils dédié à tous nos tournages internes d'animation faciale sur notre plateau de motion capture et permettant le traitement ultérieur par nos animateurs 3d ;Communiquer sur les résultats des analyses et transmettre ces informations de façon pédagogique pour un public varié ;Développer les algorithmes dédiés.Nous vous offrons la possibilité de rejoindre des équipes de passionnés et de travailler dans un environnement créatif et innovant.Niveau hiérarchiquePremier emploiType d’emploiTemps pleinFonctionIngénierieTechnologies de l’informationSecteursTechnologies et services de l’informationLogiciels informatiquesJeux électroniques",https://fr.linkedin.com/jobs/view/data-scientist-h-f-at-quantic-dream-1809957925?refId=ca677af0-294d-4686-8077-21288fd737d0&position=23&pageNum=3&trk=public_jobs_job-result-card_result-card_full-click,2020-05-04,QUANTIC DREAM,NA
DATA SCIENTIST H/F,Saint-Cloud,"Description du posteUn plan de transformation ambitieux est lancé au sein du Groupement des Mousquetaires avec un horizon de 5 - 7 ans. Ce plan se compose d’un ensemble de programmes stratégiques et de projets qui touchent l’ensemble du système cœur de métier des enseignes. La Data est un programme à part entière de ce plan transformation et est piloté par le département Data Lab de la Stime que vous intégrerez.En effet, le Data Lab a la responsabilité de l'ensemble des projets BI et Data pour les enseignes et les fonctions d'appui du Groupement (Intermarché, Netto, Supply Chain, Immo Mousquetaires, ...) En tant que Data Scientist, vos missions principales seront de : Structurer et piloter la montée en compétences analytiques et data science au sein du GroupementFournir des recommandations stratégiques et prédictives permettant aux différentes Directions du Groupement sur la base du patrimoine de données existantes, et son croisement éventuel avec des données externes afin de mieux tirer les enseignements des actions réalisées : performances passées, facteurs d’influence et d’affiner leurs choix stratégiques et leurs tactiques commercialesConstruire des services à valeur ajoutée en s’appuyant sur les algorithmes et traitements Data à l’état de l’art, ou sur des développements spécifiques internesAutres MissionsParticiper à la structuration et au pilotage de l’équipe Data Science, dans le cadre défini par le Data Lab : interactions avec les autres directions, méthodes et outils, ressources clés à mobiliser (data miners, data analysts, data scientists), choix d’internalisation ou d’externalisation des activités et algorithmes : Cadrer les priorités des projets en cohérence avec les priorités des Directions des enseignes et des fonctions d'appui du Groupement :Identifier les données disponibles - internes et externes, amont et aval – pour réaliser les analyses, et s’assurer du développement des outils adaptés au SI du GroupementEtre force de proposition sur les situations où les analytics peuvent créer de la valeur pour les directions (études de prix, client, assortiments, digital), et leur proposer des analyses, et produits répondant à leurs enjeuxCadrer les analyses (modèles d’analyses, visualisation des analyses….), piloter leur réalisation et contrôler leur qualité et pertinence au regard des enjeux des DirectionsParticiper au maintien en compétences de l’équipe Data Science : veille technologique, formations internes Contribuer au déploiement une stratégie de gouvernance de la donnéeAccompagner la transformation digitale de l’entrepriseCartographier la Data disponible et organiser les stratégies de collecteAssurer et organiser l’accès aux données produites par l’équipe Data ScienceProfil candidatNiveau d'étude min.RequisBac + 5 Formation / Diplôme :6 - MASTER 2 Expérience Requise :de 5 à 7 ans Compétences TechniquesAnalyses stratégiquesAnalyses quantitatives/ statistiquesData mining, Machine Learning et IACompétences Big Data (Spark, Python) et SQLData visualisation (Power BI,MicroStrategy…)ProfilForce de proposition,Rigueur,Réactivité,Esprit analytique et de synthèse,Aisance rédactionnelle,Bon relationnel,Sens de l’organisation.Niveau hiérarchiqueNon pertinentType d’emploiTemps pleinFonctionIngénierieTechnologies de l’informationSecteursCommerce de détail",https://fr.linkedin.com/jobs/view/data-scientist-h-f-at-groupement-les-mousquetaires-1805741600?refId=ca677af0-294d-4686-8077-21288fd737d0&position=24&pageNum=3&trk=public_jobs_job-result-card_result-card_full-click,2020-05-04,Groupement Les Mousquetaires,NA
DATA SCIENTIST H/F,Nanterre,"Au sein du service Etudes et développement de la DSI, le pôle « DATA », nouvellement créé, est en charge de centraliser les flux de données, rendre cohérentes ces données afin de fournir des analyses et indicateurs à destination des équipes internes du groupement et des magasins adhérant au groupement.A ce titre nous recrutons un DATA SCIENTIST h/fVous aurez pour missions : Construire puis maintenir l'architecture des entrepôts de données et outils d'analyseEn collaboration avec le pôle « Etudes et Performance », prendre en charge les projets les études - Formaliser les demandes issues des directions utilisatrices- Identifier les données utiles pour ces analyses, les rendre cohérentes et exploitables - Construire les modélisations à la fois mathématiques et informatiques permettant de répondre à ces demandes- Interpréter les résultats des études pour donner du sens aux analyses- Expliciter les résultats des analyses et les rendre exploitables par les directions métierEtre force de proposition sur- La construction des outils- La création de métriques et indicateurs à destination de l'ensemble des directions- Les tendances à analyser, les pistes d'études à explorerProposer et mettre en œuvre l'aspect Gouvernance des données en étroite collaboration avec le pôle « Etudes et Performance »PROFIL RECHERCHÉDe formation Bac+5 minimum type Ingénieur, vous avez une expérience d'au moins 3 ans dans l'analyse de données, au cours de laquelle vous avez développé les compétences suivantes : - animation d'ateliers internes ou de rencontres ciblées avec des experts métier et/ou techniques- analyse et synthèse des besoins- prise en charge du cycle depuis le recueil des besoins jusqu'à la restitution des analyses en passant par les phases de datacleaning, modélisation et codage - prototyper pour proposer des pistes de solution rapidesVous êtes force de proposition à la fois sur les outils à mettre en œuvre (Dataware / datamarts, algorithmes d'auto-apprentissage et cas d'usage, data-visualization) et sur l'interprétation des tendancesRigoureux, organisé, curieux, vous êtes un bon communiquant doté de qualités rédactionnelles, mais aussi curieux et aimez le travail en équipeComptétences techniques :- Socle technique robuste (Structure de données, bases de données (Postgresql, éventuellement NoSQL) programmation Python voire R)- Expertises en algorithmie,- solide bagage mathématique / statistiquesNiveau hiérarchiquePremier emploiType d’emploiTemps pleinFonctionIngénierieTechnologies de l’informationSecteursTechnologies et services de l’informationRecrutement Commerce de détail",https://fr.linkedin.com/jobs/view/data-scientist-h-f-at-optic-2000-1845678762?refId=ca677af0-294d-4686-8077-21288fd737d0&position=25&pageNum=3&trk=public_jobs_job-result-card_result-card_full-click,2020-05-04,Optic 2000,NA
Data Analyst,France,"ref: 20-230 / ou DH005902CDI – Mission en régie chez le client, grand groupe bancaire.BesoinMission au sein d’une équipe de production décisionnelle dont les tâches sont les suivantes :Analyser les anomalies détectées par le métier, résoudre les incidents, les formaliser en solutions techniques et entreprendre les développements correspondants, tout en gérant les priorités.Assurer un rôle d’expertise auprès des métiers, proposer/mettre en oeuvre des solutions de contournement en ligne , établir des modes opératoires, identifier les axes d’amélioration,Communiquer, établir un reporting de l’activité.ContexteContexte de production décisionnelle, ou il est demandé d’assurer un rôle d’expertise auprès des métiers, proposer/mettre en oeuvre des solutions de contournement en ligne, établir des modes opératoires, identifier les axes d’amélioration,Communiquer, établir un reporting de l’activité.Administrer, faire évoluer, consolider les outils de reporting et contrôle de la qualité des données : faire évoluer les reporting existants à l’aide des outils à disposition.Identifier les indicateurs permettant un suivi efficace de la qualité des données.Consolider l’ensemble des rapports existants afin d’assurer un reporting efficient. Communiquer auprès des acteurs internes.Faire appliquer les normes et processus de livraison aux équipes projetsObjectifsL’accompagnement post-production des métiers.Rédiger, mettre à jour et documenter régulièrement l’ensemble des documentations du pole.Assister les utilisateursCompétences Techniques Et FonctionnellesTechniques / Technologiques: Expérience sur des projets de migration de données Niveau Maîtrise (2) Microsoft SQL Server 2012 Niveau Maîtrise (2)SQL : développement et optimisation Niveau Expertise (4) Microsoft SSIS/SSRSNiveau hiérarchiquePremier emploiType d’emploiTemps pleinFonctionTechnologies de l’informationSecteursTechnologies et services de l’informationLogiciels informatiquesInternet",https://fr.linkedin.com/jobs/view/data-analyst-at-ardemis-partners-tech-spirit-1847332812?refId=79147b40-259b-41b4-9f46-b35419013fb1&position=1&pageNum=4&trk=public_jobs_job-result-card_result-card_full-click,2020-05-04,ARDEMIS PARTNERS - Tech Spirit,NA
