title,localisation,desc,link,date,entreprise,note
Data Scientist,Paris,"La sociétéBoldenestun leader français du crédit alternatif aux PME. Our Fintech has been a pioneer in France by financing more than 110 growing companies, thanks to a community of individual and institutional lenders, as well as a multidisciplinary team with more than 100 years of experience in finance and asset management.Reaching Bolden means choosing to progress in a demanding and dynamic environment, with its daily supply of new products. We are looking for exceptional talents, both pragmatic and team players, who have the ambition to make our history.Le posteGiven Bolden's Very Strong Growth, With a View To Pre-employment, This Internship Will Require The Ability To Focus On Many TopicsIn a context of strong growth, attached to the Chief Data Officer, we are looking for a Data Scientist intern, dedicated to machine learning and data exploitation.Credit riskMulti-channel digital marketing acquisition and strategyOptimization of Bolden processes at all levelsYour missionWe will ask you to have the flexibility of the startup spirit that we also have: the exact subject of the internship will therefore be defined at the end of the interviews. The topics that can be covered during this internship are:Design Machine LearningProvide business with analysis and Business Intelligence toolsProduce decision support analysesUnderstand the needs of business entities, work proactively by responding to requests but also be a driving force Your profile Student from a major engineering school or equivalent master's degree, preferably in the last yearA Big Data / Data Science training will be preferred but is not a prerequisiteYou know Machine Learning (ex: random forest, gradient boosting, clustering...)You know Data Science tools(R, Python...)Be passionate about the world of Data: having followed MOOC, Kaggle competitions...To have team spirit and participate 100% in the activity To have the start-up spirit ! ConditionsStart : as soon as possibleContract : 4 - 6 month internship with hiring possibility Remuneration : according to profile (+50% of reimbursed transport costs and FoodChéri meal subsidy)Address: Paris (George V), private mansion with rooftop and gym If you find yourself in this profile and want to contribute to the Bolden adventure, join us !Please send your application by email to: click apply.PostulerNiveau hiérarchiquePremier emploiType d’emploiTemps pleinFonctionIngénierieTechnologies de l’informationSecteursTechnologies et services de l’informationBanquesServices financiers",https://fr.linkedin.com/jobs/view/data-scientist-at-bolden-1767901545?refId=54cf87b2-37e7-4c92-89ac-cce785dafe95&position=24&pageNum=1&trk=public_jobs_job-result-card_result-card_full-click,2020-05-04,Bolden,NA
S&OP Data SCIENTIST,Poissy,"Description De La MissionPSA is currently implementing the « Sales & Operation Planning (S&OP) » which is a decision process at Executive Committee level, intended to optimize total value for the Company through planning. In S&OP process, important amount of data are collected and need to be analysed in order to present to ExCom the right scenario decisions on the tactical horizon.The S&OP data scientist shall understand and manipulate important volume of data used in S&OP process on worldwide perimeter for PSA Groupe (volumes per month, per country, per carline, per powertrain, per trim in demand and supply with alternative scenarios and CO2 impacts) in order to :oStructure the data for easy usage by the stakeholders (synthesis and deep dive)oPropose statistical models and algorithms to improve the S&OP forecasts, alternative scenarios and reconciliation between demand and supplyoPerform the relevant analyses on the dataoProvide business recommendations to help decision making based on the data analysisoDrive supply chain business improvement on sales forecast through big data analysis ProfilSkillsoMathematics and statisticsStatistiscal predicitive analysisScoring algorithmoITUnderstand programmation languages (Python, R,…)Datavisualisation tools (Power BI,…)Databases managementoBehaviourGood communicationAdaptabilityCapacity for synthesisBusiness mindsetInnovation / CuriosityRigor / capacity for analysisEnglish spokenEducationoBAC+5 in Science (Engineering School, Master Degree,…)Working ExperienceoAt least 5 years working in analysing and manipulating databasesoSales ForecastoExperience in FMCG (Fast Moving Consumer Good) would be appreciated Localisation du poste PaysEurope, France, Ile-de-France, Yvelines (78) Ville poissy Critères candidat Niveau d'expérience min. requis5 à 10 ans LanguesAnglais (C1 - Courant (3,5 - 4,4 Bright))Niveau hiérarchiquePremier emploiType d’emploiTemps pleinFonctionIngénierieTechnologies de l’informationSecteursTechnologies et services de l’informationLogiciels informatiquesIndustrie automobile",https://fr.linkedin.com/jobs/view/s-op-data-scientist-at-peugeot-brasil-1820787288?refId=54cf87b2-37e7-4c92-89ac-cce785dafe95&position=25&pageNum=1&trk=public_jobs_job-result-card_result-card_full-click,2020-05-04,Peugeot Brasil,NA
Data Scientist,Paris et périphérie,"Publiée par :Hélène LOMBARDHélène LOMBARDResponsable business intelligence chez MWM 
- We are STILL hiring 🚀-🚩 Faisons Connaissance !🎧MWM est à l’origine de nombreuses applications mobiles régulièrement en tête des Top Charts sur l’App Store et le Play Store📲, à l’instar d’edjing Mix ou de sa suite de jeux musicaux permettant d’apprendre le piano, la batterie, le beatmaking ou la guitare. Accomplissements🦄Success story d'un projet étudiant en 2011 devenu numéro 1 mondial des éditeurs d'applications musicales (hors streaming) selon le classement App Annie+15 apps cumulant plus de 400 millions de téléchargements à travers le monde🙌 Une détermination et une agilité qui nous a permis de devenir en quelques années l’une des seules scale-ups tech françaises rentables en FranceIntégrés au FW500, nous sommes fiers de travailler en étroite collaboration avec des géants de la Tech tels que Google et AppleBoostés par une levée de fonds de 50Md’E en Mars 2020 💥, nous recrutons +50 passionnés entre Boulogne-Billancourt et Bordeaux, pour nous aider à disrupter le secteur du divertissementAyant à coeur de créer des produits 100% imaginés et développés en interne grâce à une équipe polyvalente et agile👫, nous nous sommes donné pour mission de démocratiser la créativité à l’ère du digital, en mettant notre expertise au service d’autres domaines créatifs, tels que la photographie 📸, le dessin🎨 ou la vidéo🎥. Pour que chaque expérience soit un plaisir, une création, une communauté et un partage.Mission & challenges 💪La data occupe une place centrale dans l’activité de MWM. Au sein de notre pôle Business Intelligence, nous recherchons des Data Scientists passionnés par la transformation de la donnée brute en valeur ajouté, via des algorithmes de Machines Learning orientés business.Concrètement, vous aurez la responsabilité de construire des algorithmes permettant d’améliorer les performances de nos applications et d’aider l’ensemble des équipes à prendre les meilleures décisions.Soif de nouveaux challenges ? Travailler en tant que Data Scientist chez MWM vous amènera à :Exploiter des quantités massives de données provenant de différentes sources (user data, app data…)Proposer et déployer des use cases innovants et variés, allant du marketing prédictif au NLP en passant par des moteurs de recommandations, en accord avec la roadmap stratégiqueChallenger les modèles de Machine Learning déjà existants qui aident l’ensemble des équipes dans la prise de décisions : intégration de nouvelles données, optimisation des modèles en terme d’amélioration de temps de calcul et de robustesse, implémentation sur systèmes embarqués...Relever avec toute l’équipe MWM les défis créatifs de demainAvec qui 👫? Managée par Hélène, notre équipe Business Intelligence est aujourd'hui composée de 4 personnes. Si vous n'êtes absolument pas effrayé(e) à l'idée de traiter des millions de données, et si le compromis biais-variance vous empêche régulièrement de dormir, nous sommes faits pour nous entendre ! Au delà de notre ambiance de travail décontractée,l'équipe est très soucieuse de garantir la rigueur scientifique et la qualité de tout ce qui passe en production.🧐A propos de vousCompétences clés 🙌: Vous avez au moins deux ans d’expérience sur un poste similaire dans l’univers du digital et vous maitrisez la conception, l’optimisation et la mise en production des algorithmes de Machine Learning pour stimuler l’innovation produitVous êtes diplômé(e) d’une grande école d’ingénieurs ou de l’université (Bac +5) avec une spécialisation en data scienceVous avez de bonnes connaissances dans les librairies de data science (Scikit-Learn, Pandas, NumPy, SciPy) et dans au moins un framework (Keras, PyTorch,...)Vous êtes doté d’un fort esprit analytique et une excellente compréhension des enjeux et des leviers du marketing digital.Vous avez l’esprit d'équipe : vous souhaitez rejoindre une petite équipe et collaborer directement avec des collègues travaillant sur le développement mobile et back-end, les produits et le marketing, pour construire ensemble les produits MWM.Vous êtes proactif/ve, vous n'hésitez pas à proposer des axes d’amélioration sur les processus existantsNice to have 🤘:Vous avez déjà utilisé Google Cloud PlatformVous possédez une appétence pour l’encadrement de profils plus juniors Une expérience dans un environnement startup serait un plusLa vie chez MWM: 🚀 Une vision : développer des applications mobiles performantes qui permettent de libérer le potentiel créatif de chacun, qu’il s’agisse de musique, dessin, photographie,...Vous rejoindrez une équipe de passionnés, particulièrement tournés vers l’innovation et le test-and-learn 🔥 Un ecosystème : Scale-up en pleine croissance, rentable depuis plusieurs années, nous avons le privilège d’évoluer sur un marché grand public au potentiel quasi illimité . Qu’il s’agisse de collaborer avec des DJ tels que Martin Solveig et DJ Jazzy Jeff, travailler en étroite collaboration avec Google et Apple, ou designer de nouveaux niveaux dans notre propre studio de jeux vidéos, notre univers est riche et varié ! 🙈 Une ambiance de travail décontractée et motivante: salle de sport gratuite dans les locaux, fruits frais, snacks et boissons à volonté. Un brunch et une visite du coiffeur, de la manucure et d’un ostéo au bureau tous les mois. Un espace détente et jeux, une place de parking personnelle, des tickets restaurants, des tas d’afterworks & activités diverses, des team building à l’image de celui que nous venons de faire à Ibiza. ⭐ Un package de rémunération attractif comprenant entre autres une prime d'intéressement, un plan d'épargne entreprise - sans oublier de nombreuses perspectives de carrière. 💡 MWM est 100% remote pendant la période de confinement,préparez-vous à une expérience inédite 🤞 entre coffee break & apéros en visio ! Vous nous avez lu jusqu’ici et ça vous parle ? Vous savez ce qu’il vous reste à faire ! 😉Niveau hiérarchiqueNon pertinentType d’emploiTemps pleinFonctionIngénierieTechnologies de l’informationSecteursLogiciels informatiquesInternetDivertissements",https://fr.linkedin.com/jobs/view/data-scientist-at-mwm-1759840898?refId=e0e6ad39-d6b2-4a11-b1eb-75a1cf58430e&position=1&pageNum=2&trk=public_jobs_job-result-card_result-card_full-click,2020-05-04,MWM,NA
Product Data Scientist - Analytics,Paris,"Publiée par :Celia NAVARROCelia NAVARROGlobal Senior Recruiter - Product - at Criteo
Who We AreCriteo (NASDAQ: CRTO) is the global technology company powering the worlds marketers with trusted and impactful advertising. 2,800 Criteo team members partner with over 20,000 customers and thousands of publishers around the globe to deliver effective advertising across all channels, by applying advanced machine learning to unparalleled data sets. Criteo empowers companies of all sizes with the technology they need to better know and serve their customers.OverviewWe are innovative, passionate and result-driven. We are an interdisciplinary team, leveraging the strengths of engineers and scientists.The Data Science & Product Analytics team uses cutting edge technology, advanced statistics and machine learning to tackle some of the most complex Product challenges at Criteo. We are committed to designing and building technical solutions to strengthen Criteos Core Products and explore strategic Game Changers to keep-up with a fast-evolving product landscape. We focus on innovation to better serve new consumer behaviors and power the worlds marketers / brands / retailers / publishers with trusted and impactful advertising.We serve as trusted partners to leadership and work closely with Product Managers, R&D, Finance & Business teams.Inside Data Science & Product AnalyticsThe topics we tackle are wide and always evolving!Support the Trading strategies and R&D teams to measure and enhance our incrementalityImprove Identity solutions by optimizing our capability to recognize users across all their devices and their interactions in the open-internetWork with our Creatives team to understand users interactions with Criteo adsIdentify and deliver the most relevant insights and performance levers to our clients through our Criteo Self-Service PlatformLeverage data-driven analysis to support our Universal Catalog team, powering Criteo products.What Youll DoYou enjoy solving real-world problems with data. Our business is built on a quantitative culture. You will be assigned to one or several projects.Overall, Your Responsibilities IncludeBuild scalable analytic solutions using state-of-the-art tools based on large and granular datasetsDevelop models and conduct data-driven analysis to measure the impact of your solutionsDefine, drive and analyze results of experiments, both offline and on-line (e.g. A/B tests)Identify and quantify opportunities for optimizations and product developmentTransform business problems into actionable insightsWho You AreMasters degree or higher in a quantitative field (Mathematics, Computer Science, Physics, Engineering, Economics, etc.)Outstanding analytical skills and creative thinkingFluency In The Core Toolkit Of Data ScienceManipulating large-scale data setsBuilding data pipelinesDescriptive and predictive modelingImplementing visualizations, dashboards, and reportsExcellent interpersonal and communication skills, pro-active and independentFun to work with!Our Director of #Analytics and #datascience Charles-Henri unveil what's behind in term of missions, activities, tools, and scientific foundations on our #techblog.https://medium.com/criteo-labs/product-analytics-or-data-science-ce401b9140bd?source=friends_link&sk=05d292d6d437d7eddf3e6da5f4d43bccAt Criteo, we dare to be different. We believe that diversity fuels innovation and creates an energy that can be seen and felt all over Criteo. We champion different perspectives and are committed to creating a workplace where all Criteos are heard and feel a sense of belonging.Criteo collects your personal data for the purposes of managing Criteo's recruitment related activities. Consequently, Criteo may use your personal data in relation to the evaluation and selection of applicants. Your information will be accessible to the different Criteo entities across the world. By clicking the ""Apply"" button you expressly give your consent.Niveau hiérarchiqueNon pertinentType d’emploiTemps pleinFonctionIngénierieTechnologies de l’informationSecteursInternetMarketing et publicitéMédias en ligne",https://fr.linkedin.com/jobs/view/product-data-scientist-analytics-at-criteo-1718274253?refId=e0e6ad39-d6b2-4a11-b1eb-75a1cf58430e&position=3&pageNum=2&trk=public_jobs_job-result-card_result-card_full-click,2020-05-04,Criteo,NA
Data Analyst,France,"EntrepriseDepuis maintenant 10 ans, Famoco a pour objectif d’accompagner les entreprises dans leurs besoins de digitalisation, applications métiers et informatisation. C’est grâce à notre solution innovante et unique sur le marché que nous avons pu réaliser des projets avec nos partenaires multisectoriels comme l’ONU (à travers le World Food Program), Orange ou encore la Française des Jeux.La solution Famoco c’est la réunion de 3 éléments : Notre hardware : des terminaux mobiles NFC sécurisés et abordables  Notre OS et nos applications : un OS B2B sous Android prêt à l'emploi  Notre plateforme SaaS : un outil qui permet de configurer et contrôler les terminaux à distance. Mais ce n’est pas tout ! Famoco c’est avant tout une grande famille, multi-sites présente sur l’ensemble de nos bureaux en France (Paris et Rennes) en Belgique (Bruxelles et Liège) en Chine (Shenzen) et sur la zone Afrique (Abidjan et Nairobi).MissionVous travaillerez directement avec le comité de direction à : Imaginer et mettre en place des tableaux de bord pour la visualisation et l’analyse de ces données à destination du comité exécutif et des managers  Développer et améliorer les analyses existantes afin d'évaluer les performances de la société (les nouvelles idées sont les bienvenues) Associer des informations issues de plusieurs origines tout en conservant l’intégrité et la précision des données  Etudier les différents axes de croissance de l’entreprise  Contribuer à la digitalisation de ce modèle de marché  Participer au développement d’un outil de collecte de données Profil Recherché Etudiant(e) préparant un diplôme de niveau Bac+4/5 (année de césure ou stage de fin d'études) Spécialité souhaitée Double diplôme Ingénieur/Commerce  Vous maîtrisez parfaitement les outils informatiques de base, en particulier Excel - la connaissance de Base de données et d'outil de ""Data Visualisation"" est un plus  Vous maîtrisez les concepts majeurs de la stratégie (études de cas…) Vous faites preuve d’un forte capacité d’analyse et d’un bon esprit de synthèse  Vous avez une importante capacité d’adaptation, vous savez travailler sur des tâches multiples et vous fixer des priorités pour délivrer des rapports de qualité dans un environnement très exigeant  Votre avez un esprit entrepreneur et savez être force de proposition  Vous faîtes preuve d'un grand intérêt pour l'innovation Rejoins-nous Et Tu Pourras Vivre une aventure unique avec des collègues passionnés, technophiles et débordant d’imagination ! Développer tes compétences dans un cadre international  Prendre part à une vie d’entreprise animée au plein centre de ParisNiveau hiérarchiquePremier emploiType d’emploiTemps pleinFonctionTechnologies de l’informationSecteursTechnologies et services de l’informationLogiciels informatiquesInternet",https://fr.linkedin.com/jobs/view/data-analyst-at-famoco-1847231990?refId=e0e6ad39-d6b2-4a11-b1eb-75a1cf58430e&position=4&pageNum=2&trk=public_jobs_job-result-card_result-card_full-click,2020-05-04,Famoco,NA
Data Scientist,Paris,"Descriptif de la societeCette start-up spécialisée dans le domaine de l'énergie, compte actuellement une dizaine de personnes et développe des forfaits de consommation électriques adaptés aux besoins de chaque particulier via des énergies propres et renouvelables.DescriptionPosteRattaché au directeur général de la société, tu seras le premier Data Scientist de la team et donc une référence par la suite pour tes futurs collègues !Les Missions Sont Les Suivantes Optimisation d’algorithmes existants et développement de nouveaux algorithmes dans l’objectif de développer de nouvelles fonctionnalités et applications, et de répondre aux besoins clients :Analyse des principaux postes de consommation d’énergie, Conseils et suggestions d’économies adaptés au foyer (équipements, travaux, …), Comparaison par rapports à des foyers équivalents, Indicateurs utiles pour mieux comprendre et maîtriser la consommation Participation active à la mise en production des algorithmes et aide à la gestion des problématiques de scalabilité et Big Data Implémentation et tests des algorithmes développés Gestion d’un portefeuille de courbe de charge (consommateur et producteur) Package Salaire attractif à définir selon profil Mutuelle remboursée à 50% Transports rembrousés à 50% Tickets restaurantsLes + Esprit convivial et bienveillant Challenge technique sur un projet éthique Locaux dans un des plus beaux lieu de Paris Perspectives d'évolution à court/moyen termeProfil rechercheTu Es L'homme/femme De La Situation Si Tu te sens capable d'être dans une équipe réduite et seul sur la partie Data Science Tu possède une expérience des données énergétiques : courbe de charge et dans l’idéal une expérience dans le domaine du NILM « Non Intrusive Load Monitoring » (non obligatoire mais représenterait un avantage certain). Tu maitrise un des langages suivants : Python, C++, R Tu connais ou maitrise les technos suivantes : Spark, Scala, Cassandra, Hadoop Connaissance en Machine Learning Tu es sensbile aux problématiques liées à l'envrionnementOnly the very bestNiveau hiérarchiquePremier emploiType d’emploiTemps pleinFonctionIngénierieTechnologies de l’informationSecteursTechnologies et services de l’informationLogiciels informatiquesInternet",https://fr.linkedin.com/jobs/view/data-scientist-at-urban-linker-1344371905?refId=e0e6ad39-d6b2-4a11-b1eb-75a1cf58430e&position=5&pageNum=2&trk=public_jobs_job-result-card_result-card_full-click,2020-05-04,Urban Linker,NA
Data Scientist,France,"L'entreprise Cet organisme professionnel de 1er plan en France compte plus de 100 collaborateurs de haut niveau, regroupés sur un site unique à Paris centre. Cette entité représente 10 000 professionnels en France et qui génèrent dans leur ensemble des données variées et très importantes en volume : des millions de clients, plusieurs centaines de milliards d'euros, des millions de contrats, et de nombreux indices, statistiques, historiques de valeur, données géographiques, etc.Descriptif Du Poste Sous La Responsabilité Du Directeur Des Études Économiques, Le Collaborateur Recherché Se Verra Confier Les Missions SuivantesPour mieux gérer les demandes du Directeur Général de cet organisme et mieux le conseiller dans ses choix stratégiques, la Direction des Études Économiques créée aujourd'hui un poste de Data Scientist. analyser l'ensemble des données statistiques et économiques disponibles, évaluer et traiter les données, réaliser les études, présenter les résultats, faire des recommandations, identifier, rechercher, proposer l'acquisition de données, concevoir les croisements de données pertinents pour en extraire de la valeur afin d'aider la DG et les directions à prendre des décisions clés, créer des modèles d'analyse nouveaux pour traiter les données brutes, proposer des recommandations sur les bases de données à modifier, rapatrier les données exploitées dans le système d'information cible de façon à enrichir les bases de la DEE, participer aux rencontres avec l'INSEE et le CNIS par exemple, effectuer une veille sur le domaine de référence et sur les réseaux sociaux.Descriptif du profilPour ce poste, une formation en statistiques (de type ENSAE, ENSAI, etc..) ou économétrie est souhaitée avec une formation complémentaire éventuelle dans une spécialité telle que le datamining, le big data, ou en data science.Une expérience de 5 à 10 ans (au plus) acquise auprès d'un acteur majeur du tertiaire ou de l'industrie dans le domaine de référence est souhaitée. La connaissance d'outils tels que SAP BO, R, Python sera appréciée, tout comme la pratique de SQL et d'outils de datamining.Rigueur, bonne communication, sens de la confidentialité, créativité, autonomie : autant de qualités souhaitées pour ce poste exigeant et de haut niveau.LieuParis centrePersonne à contacterFatima BelaidiE:click applyNiveau hiérarchiquePremier emploiType d’emploiTemps pleinFonctionIngénierieTechnologies de l’informationSecteursTechnologies et services de l’informationSécurité informatique et des réseauxConseil en management",https://fr.linkedin.com/jobs/view/data-scientist-at-excelsys-rh-1767762517?refId=e0e6ad39-d6b2-4a11-b1eb-75a1cf58430e&position=6&pageNum=2&trk=public_jobs_job-result-card_result-card_full-click,2020-05-04,EXCELSYS RH,NA
