title,localisation,desc,link,date,entreprise,note
"Responsable Pilotage activité et statistiques F/H - Administration, gestion, organisation (H/F)",75 - Paris (Dept.),"Au sein du Département Recouvrement et rattaché au Directeur du recouvrement vous participez directement à la performance de nos activités et à l'amélioration de nos process :Pilotage et déploiement des campagnes multicanales à destination des clients en situation d'impayés en lien avec le plan stratégiquePréparer les ciblages clients à partir de nos bases de données en étroite collaboration avec le responsable d'activitéAlimenter et gérer les campagnes de contact client via nos plateforme/outils téléphonique, SMS, Emailing .Définir et suivre les KPI pour optimiser la stratégie multicanale contactabilité, joignabilité, efficience des moyens.Réaliser et communiquer les bilans des campagnesRéalisation d'études et reporting sur la performance des différentes activitésAnalyser par des études statistiques les résultats afin de proposer, optimiser et améliorer la performance globaleÉlaborer des études statistiques complexes pour analyser le comportement des clientsParticiper aux projets d'évolution des outils et des procédures pour améliorer nos process, réduire le risque par une meilleur maitrise de la fraude et réaliser des gains de productivitéÉlaborer des tableaux de bord mensuels destinés au suivi de la performance à destination de la Direction et du Comité ExécutifRéaliser les reporting nécessaires à votre hiérarchie et aux partenairesMéthodologieProposer, réaliser et mettre à jour les procédures de gestion au Recouvrement mais pouvant toucher également toutes les activités clients assurance, litiges.Suivre le dispositif de contrôle sur l'activité recouvrement et ses prestataires en réalisant ou faire réaliser les contrôles attendusProposer et mettre en place différents projets sur l'activité recouvrement impliquant ou non l'IT en interne et par l'intermédiaire de prestataires externesRéaliser une veille technologique afin de proposer et mettre en place des outils innovants et techniques dans le cadre de la gestion recouvrement et orienté sur le selfcare / automatisme  Titulaire d'un bac +3 , de formation économique, finance, statistiques ou juridiqueTu as une maîtrise avancée  d'Excel  Recherche V, VBA, Access, PowerBi Tu justifies d'une première expérience réussie sur un poste de responsable  de pilotage ou reporting, idéalement dans le milieu bancaireUne connaissance du crédit à la consommation serait un plus.Tu es organisée et rigoureuxseTu es reconnue pour la fiabilité des datas transmises Tu es également dotée d'un excellent relationnel qui te permettra d'interagir avec l'ensemble des collaborateursTu es force de proposition et proactifveTa curiosité te permet de toujours proposer la mise en place de nouvelles stratégies afin d'améliorer de manière continue la performance du service.Les autres avantages à rejoindre Younited ? Localisation en plein centre de Paris NotreDame de Lorette, Paris 9èmeUne culture d'entreprise très forteUn ""onboarding"" sur mesure pour faciliter ton intégration et te permettre de découvrir rapidement toutes les équipesDes animations mensuelles tournois sportifs, conférences, afterwork ...1 journée par an offerte pour faire notamment du bénévolat dans une associationun Younitour notre séminaire d'entreprise inoubliable les derniers étaient à Ibiza, ou encore en Sicile ;Possibilité de télétravail 1 jour par semainePackage proposé: Rémunération selon ton profil Tickets restaurant et 50% du titre de transport remboursé  Créée en 2009, YOUNITED CREDIT est la seule plateforme web de crédit aux particuliers en Europe disposant d'un agrément d'Etablissement de Crédit agrément ACPR et AMF. Notre modèle, totalement mutualisé, permet à des investisseurs personnes physiques, mais aussi morales : entreprises, caisses de retraites, assureurs etc. de financer directement les crédits à la consommation des particuliers. Notre mission ? Rendre le système bType de contratContrat à durée indéterminéeContrat travail",https://candidat.pole-emploi.fr/offres/recherche/detail/9716297,2020-04-29,NA,NA
Chargé(e) de mission sur les enquêtes et outils statistiques F/H - Direction recherche et développement (H/F),29 - Finistère,"La Direction du développement et des relations avec les entreprises DEVRE a pour mission d'organiser, mutualiser, consolider et valoriser l'ensemble des relations avec les entreprises de l'Ecole, au bénéfice de l'ensemble des métiers de l'Ecole. ACTIVITES :a Gère et met en œuvre en propre les enquêtes sur le placement des jeunes diplômés et sur la carrière des diplômés ; rédige les rapports statistiques, et rapports d'analyse sur les résultats de ces enquêtes. Met en œuvre, assure le respect des échéances, consolide les données, s'assure de la cohérence des données collectées et produites, produit les rapports statistiques et rapport d'analyse sur les enquêtes annuelles de placement des diplômés, et assure l'interface projet avec les structures nationales qui animent ces enquêtes Produit, vérifie, archive, les données sur les enquêtes qui sont utilisées dans les palmarès de classement des écoles d'ingénieurb Assure la maitrise d'ouvrage des évolutions de systèmes d'information, en particulier pour l'alimentation des données statistiques sur les entreprises et diplômés, aux côtés de la Direction des systèmes d'information qui assure la Maitrise d'œuvre des évolutions du système d'information SI. Collecte les besoins en matière de SI statistique sur les données partenaires Effectue une veille générique sur les outils Assure la relation avec la Direction des SI, propose et anime les échanges nécessaires aux spécifications des besoins, veille au respect des échéances Appuie les personnels DEVRE dans l'utilisation des outils, consolide les donnéesc Organise, gère, collecte, trie, met en cohérence, consolide, propose des recommandations  et met en œuvre en propre les données statistiques sur les entreprises partenaires ; s'appuie pour ce faire sur les données issues du système d'information de l'école  notamment le SI scolarité, sur les données collectées en propre par la DEVRE, sur des sources d'informations publiques ou commerciales sur les entreprises Contribue aux spécifications fonctionnelles des besoins statistiques en matière de relation entreprise, et aux format de présentation de ces statistiques Identifie les sources de données existantes au sein de l'école, les sources de données incomplètes ou manquantes pour l'établissement des statistiques, détaille les éventuels traitements à effectuer sur ces données, appuie le responsable de la gestion des partenariats sur les données à collecter, contribue à la consolidation de fichier à la demande pour des opérations de ciblage & mailing Met en œuvre les statistiques : l'archivage des données, exploite les données pour produire les statistiques à la demande, propose des analyses sur les statistiques produites pour en faire ressortir les clefs de lecture Produit, valide, archive, les indicateurs de la DEVRE qui sont dans le périmètre de la relation avec les entreprisesd Contribue aux autres activités de la DEVRE  Niveau de formation et/ou expérience requis :    Bac+5 ou équivalent, de préférence diplômé d'une école de commerce ou d'ingénieur    ou Bac+4 avec expérience professionnelle d'un minimum de 4 ans De préférence diplômée d'une école de commerce, d'ingénieur ou équivalent, la personne recrutée fait preuve :    De compétences marquées en statistiques, traitement de données et utilisation de tableur,    De compétences fonctionnelles sur les systèmes d'information,    De capacité à planifier, organiser, prioriser son travail,    D'autonomie,    De capacité d'analyse et de synthèse, de qualités rédactionnelles et relationnelles    D'attention au reporting.  IMT Atlantique école nationale supérieure MinesTélécom Atlantique BretagnePays de la Loire est une grande école d'ingénieur généraliste et un centre de recherche international dépendant du ministère en charge de l'industrie et du numérique.Type de contratContrat à durée indéterminéeContrat travail",https://candidat.pole-emploi.fr/offres/recherche/detail/9715571,2020-04-29,NA,NA
Chargé / Chargée d'études économiques et statistiques (H/F),93 - AUBERVILLIERS,"En bref : Chargé de prescription, Réseau de prescripteursType de contratContrat à durée indéterminéeContrat travail",https://candidat.pole-emploi.fr/offres/recherche/detail/9693637,2020-04-28,NA,NA
Chargé(e) d'études statistiques H/F,France,"Au sein de la Direction des Sinistres de PACIFICA, vous rejoindrez l'équipe Etudes et Planification. En tant que Chargée d'études statistiques, vous contribuerez au pilotage de l'activité et à la mesure de la performance de la Direction des Sinistres. Les missions principales de l'équipe sont les suivantes, vous serez amené à travailler sur certaines de ces missions :  Planifier l'activité des Unités de Gestion des Sinistres : Etablir des prévisions d'activité nombre de sinistres, nombre d'appels Planifier et organiser le temps de travail des collaborateurs des Unités de Gestion de Sinistres Piloter l'activité en temps réel, notamment en cas d'événement climatique  Suivre l'activité des Unités de Gestion de Sinistres : Réaliser les tableaux de bord existants et les faire évoluer Proposer de nouveaux axes d'analyse, de nouveaux indicateurs et de nouvelles mises en forme pour être au plus près des besoins de pilotage de la Direction et des UGS Préparer et animer les réunions de suivi auprès de la Direction  Mesurer la satisfaction clients : Réaliser les enquêtes à chaud et à froid Mettre en place de nouvelles enquêtes en fonction des besoins Développer l'analyse des résultats de ces enquêtes, notamment l'analyse des verbatim clients  Développer l'utilisation de techniques innovantes data science pour exploiter la multitude de données disponibles De formation supérieure bac5, vous avez idéalement une première expérience stages, CDD, CDI, , de préférence dans les domaines de la gestion de sinistres ou des centres de contact. Si vous disposez de plusieurs expériences professionnelles, une formation initiale Bac3 en statistiques peut également convenir. Etudes dans le domaine statistiqueType de contratContrat à durée indéterminéeContrat travail",https://candidat.pole-emploi.fr/offres/recherche/detail/9691012,2020-04-28,NA,NA
ANALYSTE DÉVELOPPEUR EN STATISTIQUES F/H - Informatique de gestion (H/F),67 - Rhin (Bas),"Mission principaleAu sein du secteur des Solutions Cognitives, dans un environnement innovant, rejoignez l'équipe Composants intégration qui a pour mission : l'intégration des solutions cognitives dans le SI du groupe à destination des chargés de clientèles ou des clients. la supervision, le développement, la documentation des composants technologiques. la création de nouveaux outils de suivis, de statistiques, de monitoring de performance des solutions.Selon les projets, ces composants se déclinent dans technologies différentes : C#, Angular JS, SQL Serveur, NOSQL....Activités et tâches spécifiquesEn tant qu'analyste développeur, vos missions seront les suivantes : Concevoir et rédiger des spécifications fonctionnelles, applicatives, et techniques liés aux statistiques Développer des applications et des interfaces utilisateurs présentant des statistiques et indicateurs de performances. Organiser la recette des solutions applicatives, gérer les demandes d'évolution, suivre la production Travailler en mode projet dans le respect du Système de Management de la Qualité. Créer et alimenter des bases de données  Connaissances et compétencesVous maîtrisez les développements SQL, les bases de données et vous connaissez C# et ASP .NET. Des connaissances dans les outils décisionnels Master Focus, Vertica, WebFocus seraient un plus. Vous connaissez ou êtes curieux de connaitre la méthodologie de développement agile.Savoirêtre  savoirfaireDiplômé d'un bac +4/+5 dans le domaine informatique ou scientifique, vous disposez d'une première expérience sur un poste équivalent.Vous aimez les défis techniques et apprendre de nouveaux outils ou langages. Vous êtes reconnu pour vos qualités relationnelles avec les utilisateurs ainsi que vos collègues.Vous avez le souci du respect des normes et standards qualité.On dit de vous que vous êtes organisé et que vous avez l'esprit de synthèse. Dynamique, vous savez faire preuve d'initiatives.Autres informationsLe poste basé à Strasbourg 67, est à pourvoir en CDI dès que possible.Vous bénéficierez d'avantages « Convention Collective Banque » comme : RTT et congés supplémentaires Prime d'intéressement et de participation, Conditions bancaires avantageuses, Régime de Frais de Santé et de Retraite très attractif,Aimant les challenges, vous souhaitez travailler dans un environnement innovant sur des sujets en plein essor Alors n'hésitez plus : postulez !  Euro Information, filiale Informatique du groupe de bancassurance Crédit Mutuel, conçoit, réalise, maintient et exploite un système d'information commun utilisé par le Groupe.Les activités de développement et de production informatique au niveau national et international sont assurées par environ 3200 salariés répartis sur plusieurs sites géographiques au niveau national : Strasbourg, Nancy, Dijon, Orléans, Lyon, Lille, Cergy, Val de Fontenay, Paris et Nantes.Retrouvez l'ensemble de nos films métiers sur https://www.ei.com/frfr/videosType de contratContrat à durée indéterminéeContrat travail",https://candidat.pole-emploi.fr/offres/recherche/detail/9687468,2020-04-28,NA,NA
Chargé d'Etudes Statistiques Expérimenté SAS-(H/F) - Data La Defense,75 - Paris (Dept.),"Vos disposez idealement des competences suivantes :   Creativite : vous aimez donner du sens aux donnees. Vous imaginez des outils pour aider l'entreprise a prendre des decisions operationnelles et strategiques.   Rigueur et organisation : vous pretez la plus grande attention dans l'exploitation des donnees et dans la construction des Datas orientees decisions.   Curiosite et ouverture d'esprit : vous aimez comprendre les enjeux et problematiques operationnels, echanger avec les metiers et identifier leurs besoins.   Expertise en statistique et informatique : vous maitrisez SAS et Excel. Vous faites preuve d'une appetence pour les technologies et outils informatiques orientes Bases De Donnees.   Pourquoi nous choisir ?   Societe Generale Insurance est au cA?ur de la strategie de developpement du groupe Societe Generale, en synergie avec tous les metiers de banque de detail, de banque privee et de services financiers, en France et a l'international. Presente en France avec Sogecap, Antarius, Sogessur et Oradea Vie, et dans 10 pays a l'international, Societe Generale Insurance s'appuie sur ses 2500 collaborateurs pour proposer une gamme complete de produits et de services repondant aux besoins de la clientele de particuliers, de professionnels et d'entreprises, en matiere d'assurance vie epargne, d'epargne retraite, et de protection des personnes et des biens.  Dans le cadre de notre developpement, nous recherchons un Charge d'Etudes Statistiques Experimente pour etudier et suivre l'activite de nos plateformes de relations clienteles dediees aux produits d'assurances dommages.  Nous sommes un employeur garantissant l'egalite des chances et nous sommes fiers de faire de la diversite une force pour notre entreprise.  Le groupe s'engage a reconnaitre et a promouvoir tous les talents, quels que soient leurs croyances, age, handi cap, parentalite, origine ethnique, nationalite, identite sexuelle ou de genre, orientation sexuelle, appartenance a une organisation politique, religieuse, syndicale ou a une minorite, ou toute autre caracteristique qui pourrait faire l'objet d'une discrimination.  Reference: 18000C5Z  Entite: Societe Generale Assurances  Date de debut: Immediat  Date de publication: 04/12/2019  Postuler  Partager  Charge d'Etudes Statistiques Experimente SASH/F  C.D.I   La Defense   Data   A?Type de contratContrat à durée indéterminéeContrat travail",https://candidat.pole-emploi.fr/offres/recherche/detail/9629255,2020-04-29,NA,NA
Data Scientist,Paris,"Publiée par :Geraldine NOQUETGeraldine NOQUETSenior Manager Talent Acquisition - Awalee Consulting & CoperneecVous êtes Data Scientist, passionné(e) par les études prédictives et l’ensemble des méthodes scientifiques permettant d’extraire la connaissance à partir des données ?  Awalee renforce ses équipes dédiées à la Data Science : En les rejoignant, vous aurez l’occasion d’intégrer des pôles de recherche au sein de Directions Métier ou de Data Labs, dans un écosystème allant du secteur bancaire et financier à l’ensemble de l’industrie. Vous serez amené à : Comprendre précisément les problématiques métier et les traduire de manière analytique. Identifier, collecter et préparer les données et réaliser une première analyse statistique. Développer des algorithmes permettant de répondre aux problèmes posés et veiller à leur industrialisation. Vous communiquerez vos résultats et vos solutions en les confrontant avec les équipes métier. Vous les présenterez si nécessaire en utilisant des techniques de data visualisation. Vous évoluerez également au sein de la Practice Data Science d’Awalee, et pourrez y développer des études et travaux de recherches innovants. Profil : Vous êtes diplomé(e) d’une grande Ecole d’Ingénieur et/ou d’un 3ème cycle universitaire spécialisé en Data Science ou Statistiques appliquées. Vous justifiez d’une première expérience réussie en tant que Data Scientist ou Data Analyst tous secteurs. Vous maitrisez les méthodes statistiques et avez appliqué des algorithmes de Machine learning (Supervisé: Régressions, Random Forest, Boosting, Réseaux de Neurones… | Non Supervisé : K-means, K-Medoids, CAH… | Deep learning, NLP). Vous maîtrisez au moins un des langages de programmation suivants : Python, R, SAS, Scala, SPSS. Rigoureux et curieux, vous faites preuve d’autonomie et aimez relever de nouveaux challenges scientifiques et techniques.   APPLY NOW…Niveau hiérarchiqueManagerType d’emploiTemps pleinFonctionConseilIngénierieSecteursBanquesConseil en management",https://fr.linkedin.com/jobs/view/data-scientist-at-awalee-consulting-1849878396?refId=7b704d4a-2fa7-4b17-96f6-1f879b8cd0a9&position=1&pageNum=0&trk=public_jobs_job-result-card_result-card_full-click,2020-05-04,Awalee Consulting,NA
Data Scientist,Saclay,"Data Scientist  Are you a motivated professional, passionate about new technologies with a desire to transform the way people do business? Do you enjoy helping customers to enhance their business by applying cutting edge technologies ? Are you business minded, pro-active, curious and independent? If you enjoy working with statistical models and complex algorithms on diverse business environments then you are the one we are looking for to reinforce our Digital Software and Solutions team as a Data Scientist! As part of our practice in France, you will be at the forefront of digital, part of our solution development team to help our customers make faster, smarter decisions and solve business issues by developing new data driven solutions. Your responsibilities include the design, development, testing and implementation of issue-based solutions, more precisely by: Collecting and formulating the business requirements & analyzing the customer’s needs; Building and implementing deep learning computer vision models to enhance our business solutions; Building and implement machine learning models and prototype solutions for proof-of-concept; Developing data products and predictive models in collaboration with the developers; Relying on evolutionary computing techniques to solve optimization problems; Predicting, classifying and relating data; Supporting the customer throughout the entire implementation schedule;  Working in close collaboration with the product owner and the customer’s project team; Coaching junior data scientists Your profile You have a degree in Computer Science, Mathematics, or Engineering, hands-on experience (minimum 4 years) within the IT or a start-up and with machine learning, deep learning and computer vision technologies. You have already worked with edge computing solutions and can think about optimization both in terms of computing performance as well as accuracy. You are also familiar with languages such as Python, SQL, and frameworks such as Tensor Flow. As a person you are curious and independent by nature, you like to combine your technological background to a business environment and enjoy working and interacting on daily basis with clients. On top of that, you have excellent communication skills and focus all efforts on ensuring the customer satisfaction. Next to this you have excellent French and English language skills.   What You Can Expect From Us   It is an extraordinary time to be in business. As digital transformation continues to accelerate, Fujitsu wants to be in the heart/center of our clients’ digital journeys and offering our professionals exciting career opportunities. In this changing fast pace environment, we value the work-life balance (flexible working times, home office etc.). You will be able to reinforce your skills with our tailored made training conducted in the classroom, online, or in collaboration with teammates. You will be part of a company promotes diversity, equality and inclusion. We offer you an attractive salary and secondary benefits, including a variable bonus scheme.Niveau hiérarchiqueConfirméType d’emploiTemps pleinFonctionIngénierieSecteursTechnologies et services de l’information",https://fr.linkedin.com/jobs/view/data-scientist-at-fujitsu-france-1793224904?refId=7b704d4a-2fa7-4b17-96f6-1f879b8cd0a9&position=2&pageNum=0&trk=public_jobs_job-result-card_result-card_full-click,2020-05-04,Fujitsu France,NA
